{
  "schemaVersion": 1,
  "oracle": "complete canonical flow-table bytes plus exact structural counters",
  "bytes": 208,
  "sha256": "749c83f435cfc7965a5e13a9fdc7a90772a2c44f9899ce15e041fe0d47a562f3",
  "expectedWords": [
    1346584912,
    1,
    8,
    7,
    7,
    3,
    2,
    2,
    2,
    1,
    3,
    3,
    4,
    6,
    511,
    52,
    6,
    3221225994,
    3325256724,
    49152,
    80,
    2,
    43,
    1,
    1,
    6,
    3325256724,
    3221225994,
    80,
    49152,
    1,
    40,
    1,
    1,
    17,
    3221225994,
    3405803829,
    53000,
    53,
    1,
    30,
    2,
    1,
    17,
    3405803829,
    3221225994,
    53,
    53000,
    1,
    46,
    2,
    1
  ],
  "counters": {
    "packetRecords": 8,
    "ethernetHeaders": 7,
    "ipv4Headers": 7,
    "tcpHeaders": 3,
    "udpHeaders": 2,
    "dnsMessages": 2,
    "httpMessages": 2,
    "dnsCompressionPointers": 1,
    "tcpReassemblyAppends": 3,
    "malformedPackets": 3,
    "flowTableProbes": 6,
    "packetBytes": 511,
    "allocations": 14,
    "boundaryCrossings": 0,
    "flows": 4,
    "outputBytes": 208
  }
}
